{
  "$schema":"https://json-schema.org/draft/2020-12/schema",
  "$id":"https://federation.local/schemas/federation_spatial_impact_report_v1.schema.json",
  "title":"Federation Spatial Impact Report v1","type":"object","additionalProperties":false,
  "required":["contract_version","producer_repo","branch","base_sha","changes","affected_consumers","backward_compatible","gates"],
  "properties":{
    "contract_version":{"const":"federation-spatial-impact/1.0"},"producer_repo":{"enum":["spiderweb-pr","moneysweep-pr","aguayluz-pr","skywatcher-pr"]},"branch":{"type":"string"},"base_sha":{"type":"string","pattern":"^[a-f0-9]{40}$"},"head_sha":{"type":["string","null"],"pattern":"^[a-f0-9]{40}$"},
    "changes":{"type":"object","required":["contracts","schemas","geometry_semantics","crs","api"],"properties":{"contracts":{"type":"array","items":{"type":"string"}},"schemas":{"type":"array","items":{"type":"string"}},"geometry_semantics":{"type":"array","items":{"type":"string"}},"crs":{"type":"array","items":{"type":"string"}},"api":{"type":"array","items":{"type":"string"}}}},
    "affected_consumers":{"type":"array","items":{"type":"object","required":["repo","impact","reason"],"properties":{"repo":{"enum":["spiderweb-pr","moneysweep-pr","aguayluz-pr","skywatcher-pr"]},"impact":{"enum":["REQUIRED","OPTIONAL","NONE"]},"reason":{"type":"string"},"migration":{"type":["string","null"]}}}},
    "backward_compatible":{"type":"boolean"},"rollback":{"type":"string"},
    "gates":{"type":"object","required":["schema","geometry","tests","security","performance","desktop","ios","federation"],"additionalProperties":{"enum":["PASS","OPEN","BLOCKED","N/A"]}}
  }
}